"ContractLocation","VendorFolder","Filename","FilePath","Extension","FileCreatedDate","DocType","HasSignedKeyword","SigningStatus","IsAmendment","AmendmentNumber","VersionLabel","DateInFilename","CounterpartyName","EffectiveDate","ExpirationDate","Notes"
"01 Active Contracts","Safety Plus Inc","DCS Vendor Mutual NDA to Safety Plus Inc -signed 12.12.2024.pdf","Safety Plus Inc/DCS Vendor Mutual NDA to Safety Plus Inc -signed 12.12.2024.pdf",".pdf","2026-01-14","MNDA","True","Signed","False","","","12.12.2024","Safety Plus Inc","2024-11-12","2026-11-12",""
"01 Active Contracts","Schmalz","DCS Schmalz Vendor Mutual NDA 10.06.25.pdf","Schmalz/DCS Schmalz Vendor Mutual NDA 10.06.25.pdf",".pdf","2026-05-15","MNDA","True","Signed","False","","","10.06.25","Schmalz, Inc","2026-05-15","",""
"01 Active Contracts","Schmalz, Inc","DCS Schmalz Vendor Mutual NDA 10.06.25.pdf","Schmalz, Inc/DCS Schmalz Vendor Mutual NDA 10.06.25.pdf",".pdf","2026-01-14","MNDA","True","Signed","False","","","10.06.25","Schmalz, Inc","2026-01-14","",""
"02 Unsigned Contracts","Sealed Air Corp","Mutual NDA- Sealed Air.docx","Sealed Air Corp/Mutual NDA- Sealed Air.docx",".docx","2026-01-14","MNDA","False","Unsigned","False","","","","Sealed Air Corporation","2026-01-14","",""
"02 Unsigned Contracts","Sealed Air Corp","Mutual NDA- Sealed Air.pdf","Sealed Air Corp/Mutual NDA- Sealed Air.pdf",".pdf","2026-01-14","MNDA","False","Unsigned","False","","","","Sealed Air Corporation","2026-01-14","",""
"02 Unsigned Contracts","Shipmonk","ShipMonk DCS MNDA.pdf","Shipmonk/ShipMonk DCS MNDA.pdf",".pdf","2026-01-14","MNDA","False","Unsigned","False","","","","Shipmonk","2026-01-14","",""
"02 Unsigned Contracts","Shippers Supply","ShippersSupply-DCS MNDA 04.22.26 executed.pdf","Shippers Supply/ShippersSupply-DCS MNDA 04.22.26 executed.pdf",".pdf","2026-04-24","MNDA","False","Unsigned","False","","","04.22.26","Shippers Supply","2026-04-24","",""
"02 Unsigned Contracts","Shorr","Shorr NDA.docx","Shorr/Shorr NDA.docx",".docx","2026-01-14","MNDA","False","Unsigned","False","","","","Shorr Packaging Corp","2026-01-14","",""
"02 Unsigned Contracts","Shorr","Shorr NDA.pdf","Shorr/Shorr NDA.pdf",".pdf","2026-01-14","MNDA","False","Unsigned","False","","","","Shorr Packaging Corp","2026-01-14","",""
"02 Unsigned Contracts","SI Systems","Form NDA - v4 08_05_16.pdf","SI Systems/Form NDA - v4 08_05_16.pdf",".pdf","2026-01-14","NDA","True","Unsigned","False","","","08_05_16","SI Systems, LLC","2026-01-14","",""
"02 Unsigned Contracts","SICK","Mutual NDA- SICK.docx","SICK/Mutual NDA- SICK.docx",".docx","2026-01-14","MNDA","False","Unsigned","False","","","","SICK, INC","2026-01-14","",""
"02 Unsigned Contracts","SICK","Mutual NDA- SICK.pdf","SICK/Mutual NDA- SICK.pdf",".pdf","2026-01-14","MNDA","False","Unsigned","False","","","","SICK, INC","2026-01-14","",""
"02 Unsigned Contracts","Siemens","Non-Disclosure Agreement - Siemens 2019_unsigned.pdf","Siemens/Non-Disclosure Agreement - Siemens 2019_unsigned.pdf",".pdf","2026-01-14","NDA","True","Unsigned","False","","","","Siemens Postel, Parel, and Airport Logistics","2026-01-14","",""
"02 Unsigned Contracts","Sitma","Sitma Mutual NDA.pdf","Sitma/Sitma Mutual NDA.pdf",".pdf","2026-01-14","MNDA","False","Unsigned","False","","","","SITMA USA, Inc","2026-01-14","",""
"01 Active Contracts","Softchoice","2024.04.23 Softchoice DCS MSA FINAL.pdf","Softchoice/2024.04.23 Softchoice DCS MSA FINAL.pdf",".pdf","2026-01-14","MSA","False","Signed","False","","Final","","Softchoice LP","2026-01-14","",""
"01 Active Contracts","Softeon","Softeon - NDA.pdf","Softeon/Softeon - NDA.pdf",".pdf","2026-01-14","MNDA","True","Signed","False","","","","Softeon, Inc","2026-01-14","upon written notice",""
"02 Unsigned Contracts","Southern Industrial Constructors","Mutual NDA 5_18_2022.docx","Southern Industrial Constructors/Mutual NDA 5_18_2022.docx",".docx","2026-01-14","MNDA","False","Unsigned","False","","","5_18_2022","Southern Industrial Constructors","2026-01-14","",""
"02 Unsigned Contracts","Southern Industrial Constructors","Mutual NDA 5_18_2022.pdf","Southern Industrial Constructors/Mutual NDA 5_18_2022.pdf",".pdf","2026-01-14","MNDA","False","Unsigned","False","","","5_18_2022","Southern Industrial Constructors","2026-01-14","",""
"01 Active Contracts","SpanTech","SpanTech DCS Vendor Mutual NDA 03.25.26 - signed.pdf","SpanTech/SpanTech DCS Vendor Mutual NDA 03.25.26 - signed.pdf",".pdf","2026-03-25","MNDA","True","Signed","False","","","03.25.26","Span Tech, LLC","2026-03-25","2028-03-25",""
"02 Unsigned Contracts","SPF (Southern Precision Fabrication)","SPF NDA 3-31-2023.docx","SPF (Southern Precision Fabrication)/SPF NDA 3-31-2023.docx",".docx","2026-01-14","MNDA","False","Unsigned","False","","","","SPF (Southern Precision Fabrication)","2026-01-14","",""
"02 Unsigned Contracts","SPF (Southern Precision Fabrication)","SPF NDA 3-31-2023.pdf","SPF (Southern Precision Fabrication)/SPF NDA 3-31-2023.pdf",".pdf","2026-01-14","MNDA","False","Unsigned","False","","","","SPF (Southern Precision Fabrication)","2026-01-14","",""
"02 Unsigned Contracts","Spring_Creform","Creform NDA 2018.doc","Spring_Creform/Creform NDA 2018.doc",".doc","2026-01-14","NDA","False","Unsigned","False","","","","Spring_Creform","2026-01-14","",""
"02 Unsigned Contracts","Spring_Creform","Creform NDA 2018.pdf","Spring_Creform/Creform NDA 2018.pdf",".pdf","2026-01-14","NDA","True","Unsigned","False","","","","Spring Automation, LLC","2026-01-14","",""
"01 Active Contracts","Spring_Intelligrated","Spring Automation_Standard Intelligrated Mutual NDA (US) 2018.pdf","Spring_Intelligrated/Spring Automation_Standard Intelligrated Mutual NDA (US) 2018.pdf",".pdf","2026-01-14","MNDA","True","Signed","False","","","","Intelligrated Systems, LLC","2026-01-14","",""
"02 Unsigned Contracts","Spring_SSK","SSK MNDA (Spring Automation) (4837-0738-7759 v1) soft copy (002) signed.pdf","Spring_SSK/SSK MNDA (Spring Automation) (4837-0738-7759 v1) soft copy (002) signed.pdf",".pdf","2026-01-14","MNDA","False","Unsigned","False","","","","SYSTEM SOLUTIONS OF KENTUCKY, LLC","2018-09-10","",""
"02 Unsigned Contracts","Starrett","DCS NDA.pdf","Starrett/DCS NDA.pdf",".pdf","2026-01-14","NDA","False","Unsigned","False","","","","Starrett","2026-01-14","",""
"02 Unsigned Contracts","Starrett","Mutual Confidentiality Agreement (A6993125x7A575) prepared by Mirick O'Connell.doc","Starrett/Mutual Confidentiality Agreement (A6993125x7A575) prepared by Mirick O'Connell.doc",".doc","2026-01-14","MNDA","False","Unsigned","False","","","","Starrett","2026-01-14","",""
"02 Unsigned Contracts","Starrett","Task.0526-6_NDA_Contract_Work_20191217 DRAFT.pdf","Starrett/Task.0526-6_NDA_Contract_Work_20191217 DRAFT.pdf",".pdf","2026-01-14","NDA","False","Unsigned","False","","Draft","","Starrett","2026-01-14","",""
"02 Unsigned Contracts","Steel King","DSC Mutual Nondisclosure Agreement - DJH Signed - signed.pdf","Steel King/DSC Mutual Nondisclosure Agreement - DJH Signed - signed.pdf",".pdf","2026-01-14","MNDA","True","Unsigned","False","","","","Steel King","2023-04-04","",""
"02 Unsigned Contracts","Steel King","Mutual NDA- Steel King.docx","Steel King/Mutual NDA- Steel King.docx",".docx","2026-01-14","MNDA","False","Unsigned","False","","","","Steel King Industries, Inc","2026-01-14","",""
"02 Unsigned Contracts","Steel King","Mutual NDA- Steel King.pdf","Steel King/Mutual NDA- Steel King.pdf",".pdf","2026-01-14","MNDA","False","Unsigned","False","","","","Steel King Industries, Inc","2026-01-14","",""
"02 Unsigned Contracts","Steele Solutions","MNDA DCS to Steele Solutions for DCS Signature - signed 2.6.2025.pdf","Steele Solutions/MNDA DCS to Steele Solutions for DCS Signature - signed 2.6.2025.pdf",".pdf","2026-01-14","MNDA","True","Unsigned","False","","","2.6.2025","Steele Solutions","2025-02-06","",""
"02 Unsigned Contracts","Stock MHS","Stock MHS NDA 3-31-2023.docx","Stock MHS/Stock MHS NDA 3-31-2023.docx",".docx","2026-01-14","MNDA","False","Unsigned","False","","","","Stock MHS","2026-01-14","",""
"02 Unsigned Contracts","Stock MHS","Stock MHS NDA 3-31-2023.pdf","Stock MHS/Stock MHS NDA 3-31-2023.pdf",".pdf","2026-01-14","MNDA","False","Unsigned","False","","","","Stock MHS","2026-01-14","",""
"02 Unsigned Contracts","SVT","DCS NDA -  SVT Robotics Inc -Executed.pdf","SVT/DCS NDA -  SVT Robotics Inc -Executed.pdf",".pdf","2026-01-14","MNDA","True","Signed","False","","","","SVT ROBOTICS, Inc","2020-12-02","2023-12-02",""
"02 Unsigned Contracts","SVT Robotics","DCS NDA -  SVT Robotics Inc -Executed.pdf","SVT Robotics/DCS NDA -  SVT Robotics Inc -Executed.pdf",".pdf","2026-05-16","MNDA","True","Signed","False","","","","SVT ROBOTICS, Inc","2020-12-02","2023-12-02",""
"01 Active Contracts","syncreon","syncreon NDA.pdf","syncreon/syncreon NDA.pdf",".pdf","2026-01-14","NDA","False","Signed","False","","","","syncreon Acquisition Corp","2022-03-04","",""
"02 Unsigned Contracts","System Scale","Mutual NDA- System Scale.docx","System Scale/Mutual NDA- System Scale.docx",".docx","2026-01-14","MNDA","False","Unsigned","False","","","","System Scale, Co","2026-01-14","",""
"02 Unsigned Contracts","System Scale","Mutual NDA- System Scale.pdf","System Scale/Mutual NDA- System Scale.pdf",".pdf","2026-01-14","MNDA","False","Unsigned","False","","","","System Scale, Co","2026-01-14","",""
"01 Active Contracts","Systems Automated","Mutual NDA- Sytems Automated - signed.pdf","Systems Automated/Mutual NDA- Sytems Automated - signed.pdf",".pdf","2026-01-14","MNDA","True","Signed","False","","","","Systems Automated","2025-05-22","2027-05-22",""
"01 Active Contracts","TE Connectivity","NDA-Designed Conveyor Systems LLC.docx","TE Connectivity/NDA-Designed Conveyor Systems LLC.docx",".docx","2026-01-14","NDA","True","Signed","False","","","","TE CONNECTIVITY CORPORATION","2022-04-13","2027-04-13",""
"02 Unsigned Contracts","Tech Products","Mutual NDA- Tech Products.docx","Tech Products/Mutual NDA- Tech Products.docx",".docx","2026-01-14","MNDA","False","Unsigned","False","","","","Tech Products","2026-01-14","",""
"02 Unsigned Contracts","Tech Products TPIA Licenses","Arizona State Contractors License TPIA EXP NOV 01 2025.pdf","Tech Products TPIA Licenses/Arizona State Contractors License TPIA EXP NOV 01 2025.pdf",".pdf","2026-01-14","Other","False","Unsigned","False","","","","Tech Products TPIA Licenses","2026-01-14","",""
"02 Unsigned Contracts","Tech Products TPIA Licenses","Arkansas State Contractor License Tech Products EXP APRIL 30 2025.pdf","Tech Products TPIA Licenses/Arkansas State Contractor License Tech Products EXP APRIL 30 2025.pdf",".pdf","2026-01-14","License","False","Unsigned","False","","","","Tech Products TPIA Licenses","2026-01-14","",""
"02 Unsigned Contracts","Tech Products TPIA Licenses","Mississippi State Contractor License Tech Products EXP MAY 27 2025.pdf","Tech Products TPIA Licenses/Mississippi State Contractor License Tech Products EXP MAY 27 2025.pdf",".pdf","2026-01-14","License","False","Unsigned","False","","","","Tech Products TPIA Licenses","2026-01-14","",""
"02 Unsigned Contracts","Tech Products TPIA Licenses","Nevada State Contractors License EXP AUG 31 2025.pdf","Tech Products TPIA Licenses/Nevada State Contractors License EXP AUG 31 2025.pdf",".pdf","2026-01-14","Other","False","Unsigned","False","","","","Tech Products TPIA Licenses","2026-01-14","",""
"02 Unsigned Contracts","Tech Products TPIA Licenses","South Carolina Contractors License TPIA EXP OCT 31 2026.pdf","Tech Products TPIA Licenses/South Carolina Contractors License TPIA EXP OCT 31 2026.pdf",".pdf","2026-01-14","Other","False","Unsigned","False","","","","Tech Products TPIA Licenses","2026-01-14","",""
"02 Unsigned Contracts","Tech Products TPIA Licenses","Tennessee State Contractor License Tech Products EXP SEPT 30 2025.pdf","Tech Products TPIA Licenses/Tennessee State Contractor License Tech Products EXP SEPT 30 2025.pdf",".pdf","2026-01-14","License","False","Unsigned","False","","","","Tech Products TPIA Licenses","2026-01-14","",""
"01 Active Contracts","Terracon","Designed Conveyor Systems_Terracon MSA 10.28.25 - signed.pdf","Terracon/Designed Conveyor Systems_Terracon MSA 10.28.25 - signed.pdf",".pdf","2026-01-14","MSA","True","Signed","False","","","10.28.25","Terracon Consultants, Inc","2025-10-28","upon written notice",""
"02 Unsigned Contracts","Terracon","Mutual NDA Terracon_Feb 2022.pdf","Terracon/Mutual NDA Terracon_Feb 2022.pdf",".pdf","2026-01-14","MNDA","False","Unsigned","False","","","","Terracon","2026-01-14","",""
"01 Active Contracts","Terracon","Terracon_DCS MNDA 06.02.25 - signed.pdf","Terracon/Terracon_DCS MNDA 06.02.25 - signed.pdf",".pdf","2026-01-14","MNDA","True","Signed","False","","","06.02.25","Terracon Consultants, Inc","2025-06-02","2027-06-02",""
"02 Unsigned Contracts","Terralytiq","DCS-Terralytiq evaluation license agreement executed 04.01.26.pdf","Terralytiq/DCS-Terralytiq evaluation license agreement executed 04.01.26.pdf",".pdf","2026-04-02","EULA","False","Unsigned","False","","","04.01.26","Terralytiq, Inc","2026-03-26","2031-03-26",""
"01 Active Contracts","Tevora","2024 MSA Tevora-DCS 2.12.2024_FINAL.pdf","Tevora/2024 MSA Tevora-DCS 2.12.2024_FINAL.pdf",".pdf","2026-01-14","MSA","False","Signed","False","","","","Tevora Business Solutions, Inc","2026-01-14","",""
"02 Unsigned Contracts","Tevora","MSA Tevora DCS 2.12.2024_FINAL signed 5.7.2024.pdf","Tevora/MSA Tevora DCS 2.12.2024_FINAL signed 5.7.2024.pdf",".pdf","2026-01-14","MSA","True","Signed","False","","","5.7.2024","Tevora Business Solutions, Inc","2024-05-07","2025-05-07",""
"02 Unsigned Contracts","TGW","Mutual NDA- TGW_Signed - signed.pdf","TGW/Mutual NDA- TGW_Signed - signed.pdf",".pdf","2026-01-14","MNDA","True","Unsigned","False","","","","TGW","2024-04-23","",""
"02 Unsigned Contracts","TGW","Mutual NDA- TGW.docx","TGW/Mutual NDA- TGW.docx",".docx","2026-01-14","MNDA","False","Unsigned","False","","","","TGW Systems, Inc","2026-01-14","",""
"02 Unsigned Contracts","TGW","Mutual NDA- TGW.pdf","TGW/Mutual NDA- TGW.pdf",".pdf","2026-01-14","MNDA","False","Unsigned","False","","","","TGW Systems, Inc","2026-01-14","",""
"02 Unsigned Contracts","Tiffany and Company","Confidentiality MNDA Mutual Agreement with LVMH and Tiffany Supplier Code of Conduct updated 1.11.23.doc","Tiffany and Company/Confidentiality MNDA Mutual Agreement with LVMH and Tiffany Supplier Code of Conduct updated 1.11.23.doc",".doc","2026-01-14","MNDA","False","Unsigned","False","","","1.11.23","Tiffany and Company","2026-01-14","",""
"01 Active Contracts","Tiffany and Company","Confidentiality MNDA Mutual Agreement with LVMH and Tiffany Supplier Code of Conduct updated 1.11.23.pdf","Tiffany and Company/Confidentiality MNDA Mutual Agreement with LVMH and Tiffany Supplier Code of Conduct updated 1.11.23.pdf",".pdf","2026-01-14","MNDA","False","Signed","False","","","1.11.23","Tiffany and Company","2026-01-14","",""
"02 Unsigned Contracts","Tiffin","Tiffin NDA.doc","Tiffin/Tiffin NDA.doc",".doc","2026-01-14","NDA","False","Unsigned","False","","","","Tiffin","2026-01-14","",""
"01 Active Contracts","Titan Permit Solutions, LLC","TPS_MNDA_2026-03-04 - signed.pdf","Titan Permit Solutions, LLC/TPS_MNDA_2026-03-04 - signed.pdf",".pdf","2026-03-06","MNDA","True","Signed","False","","","","Titan Permit Solutions, LLC","2026-03-04","2028-03-04",""
"01 Active Contracts","Tompkins Robotics","Mutual NDA DCS Tompkins Robotics 20250624.docx.pdf","Tompkins Robotics/Mutual NDA DCS Tompkins Robotics 20250624.docx.pdf",".pdf","2026-01-14","MNDA","True","Signed","False","","","20250624","Tompkins Robotics, Inc","2026-01-14","",""
"01 Active Contracts","TPIA LLC","DCS Vendor Mutual NDA to TPIA LLC 10.28.2024.pdf","TPIA LLC/DCS Vendor Mutual NDA to TPIA LLC 10.28.2024.pdf",".pdf","2026-01-14","MNDA","True","Signed","False","","","10.28.2024","TPIA LLC","2024-10-11","2026-10-11",""
"02 Unsigned Contracts","Tractor Supply","DCS TSC NDA 2021.03.21.pdf","Tractor Supply/DCS TSC NDA 2021.03.21.pdf",".pdf","2026-01-14","NDA","False","Unsigned","False","","","","Tractor Supply","2026-01-14","",""
"02 Unsigned Contracts","Trew","Mutual NDA- Trew - BC Edits 7.24.2023.docx","Trew/Mutual NDA- Trew - BC Edits 7.24.2023.docx",".docx","2026-01-14","MNDA","False","Unsigned","False","","","7.24.2023","Trew, LLC","2026-01-14","",""
"02 Unsigned Contracts","Trew","Mutual NDA- Trew - BC Edits 8.10.2023.docx","Trew/Mutual NDA- Trew - BC Edits 8.10.2023.docx",".docx","2026-01-14","MNDA","False","Unsigned","False","","","8.10.2023","Trew, LLC","2026-01-14","",""
"02 Unsigned Contracts","Trew","Mutual NDA- Trew - BC Edits 8.3.2023.docx","Trew/Mutual NDA- Trew - BC Edits 8.3.2023.docx",".docx","2026-01-14","MNDA","False","Unsigned","False","","","8.3.2023","Trew, LLC","2026-01-14","",""
"02 Unsigned Contracts","Trew","Mutual NDA- Trew.docx","Trew/Mutual NDA- Trew.docx",".docx","2026-01-14","MNDA","False","Unsigned","False","","","","Trew, LLC","2026-01-14","",""
"02 Unsigned Contracts","Trew","Mutual NDA- Trew.pdf","Trew/Mutual NDA- Trew.pdf",".pdf","2026-01-14","MNDA","False","Unsigned","False","","","","Trew, LLC","2026-01-14","",""
"02 Unsigned Contracts","Trinity Solutions","Trinity NDA Agreement - Designed Conveyor Systems - 20230705.pdf","Trinity Solutions/Trinity NDA Agreement - Designed Conveyor Systems - 20230705.pdf",".pdf","2026-01-14","MNDA","True","Signed","False","","","20230705","Trinity Integrated Solutions, Inc","2023-07-05","2025-07-05",""
"02 Unsigned Contracts","Troax, INC","Mutual NDA- Troax.docx","Troax, INC/Mutual NDA- Troax.docx",".docx","2026-01-14","MNDA","False","Unsigned","False","","","","Troax, INC","2026-01-14","",""
"02 Unsigned Contracts","Troax, INC","Mutual NDA- Troax.pdf","Troax, INC/Mutual NDA- Troax.pdf",".pdf","2026-01-14","MNDA","False","Unsigned","False","","","","Troax, INC","2026-01-14","",""
"02 Unsigned Contracts","UDXD","NDA DCS to UDXD Signature Page 5.23.2024.pdf","UDXD/NDA DCS to UDXD Signature Page 5.23.2024.pdf",".pdf","2026-01-14","NDA","False","Unsigned","False","","","5.23.2024","UDXD","2026-01-14","",""
"01 Active Contracts","UniFirst","MUTUAL CONFIDENTIALITY AND NONDISCLOSURE AGREEMENT.pdf","UniFirst/MUTUAL CONFIDENTIALITY AND NONDISCLOSURE AGREEMENT.pdf",".pdf","2026-01-14","MNDA","False","Signed","False","","","","UniFirst","2026-01-14","upon written notice",""
"02 Unsigned Contracts","United Hardware","United Hardware NDA.pdf","United Hardware/United Hardware NDA.pdf",".pdf","2026-01-14","NDA","False","Unsigned","False","","","","United Hardware","2026-01-14","",""
"02 Unsigned Contracts","Universal Robotics","Universal Robotics Mutual NDA.pdf","Universal Robotics/Universal Robotics Mutual NDA.pdf",".pdf","2026-01-14","MNDA","False","Unsigned","False","","","","Universal Robotics, Inc","2026-01-14","",""
"02 Unsigned Contracts","UPS","UPS NDA - Read carefully and share with your teams.msg","UPS/UPS NDA - Read carefully and share with your teams.msg",".msg","2026-01-14","NDA","False","Unsigned","False","","","","UPS","2026-01-14","",""
"02 Unsigned Contracts","Upward Farms","Upward Farms One-Way NDA Form (Default) as of 5-24-21 DCS Mutual.docx","Upward Farms/Upward Farms One-Way NDA Form (Default) as of 5-24-21 DCS Mutual.docx",".docx","2026-01-14","NDA","False","Unsigned","False","","","","Upward Enterprises Inc","2026-01-14","upon written notice",""
"01 Active Contracts","Urbx","Urbx_NDA_DCS.pdf","Urbx/Urbx_NDA_DCS.pdf",".pdf","2026-05-15","NDA","True","Signed","False","","","","Urbx Inc","2023-03-19","",""
"01 Active Contracts","USPS","Executed 3APCKG-24-B-0005.pdf","USPS/Executed 3APCKG-24-B-0005.pdf",".pdf","2026-04-08","Other","True","Signed","False","","","","USPS","2024-06-30","",""
"02 Unsigned Contracts","Valence Industrial","Mutual NDA- Valence Industrial.docx","Valence Industrial/Mutual NDA- Valence Industrial.docx",".docx","2026-01-14","MNDA","False","Unsigned","False","","","","Valence Industrial","2026-01-14","",""
"02 Unsigned Contracts","Valence Industrial","Mutual NDA- Valence Industrial.pdf","Valence Industrial/Mutual NDA- Valence Industrial.pdf",".pdf","2026-01-14","MNDA","False","Unsigned","False","","","","Valence Industrial","2026-01-14","",""
"02 Unsigned Contracts","Vanderlande","Mutual NDA DCS to Vanderlande - 10.2.24 - signed 10.15.2024.pdf","Vanderlande/Mutual NDA DCS to Vanderlande - 10.2.24 - signed 10.15.2024.pdf",".pdf","2026-01-14","MNDA","True","Unsigned","False","","","10.2.24","Vanderlande Industries B","2024-10-10","",""
"02 Unsigned Contracts","Vecna Robotics","Mutual NDA- Vecna.docx","Vecna Robotics/Mutual NDA- Vecna.docx",".docx","2026-01-14","MNDA","False","Unsigned","False","","","","Vecna Robotics, Inc","2026-01-14","",""
"02 Unsigned Contracts","Vecna Robotics","Mutual NDA- Vecna.pdf","Vecna Robotics/Mutual NDA- Vecna.pdf",".pdf","2026-01-14","MNDA","False","Unsigned","False","","","","Vecna Robotics, Inc","2026-01-14","",""
"02 Unsigned Contracts","Ventura Foods","MUTUAL CONFIDENTIALITY AND NONDISCLOSURE AGREEMENT DESINGED CONVEYOR VENTURA REDLINE 04192023 (002).docx","Ventura Foods/MUTUAL CONFIDENTIALITY AND NONDISCLOSURE AGREEMENT DESINGED CONVEYOR VENTURA REDLINE 04192023 (002).docx",".docx","2026-01-14","MNDA","False","Signed","False","","Redline","04192023","the “Counterparty”","2026-01-14","upon written notice",""
"01 Active Contracts","Voestalpine","DCS - voestalpine Mutual NDA 02.18.25 (Final) - signed.pdf","Voestalpine/DCS - voestalpine Mutual NDA 02.18.25 (Final) - signed.pdf",".pdf","2026-01-14","MNDA","True","Signed","False","","Final","02.18.25","voestalpine Clad Rack Solutions LLC","2025-02-18","",""
"01 Active Contracts","Waites","MNDA - Waites & Designed Conveyor.pdf","Waites/MNDA - Waites & Designed Conveyor.pdf",".pdf","2026-05-16","MNDA","False","Signed","False","","","","WAITES SENSOR TECHNOLOGIES, INC","2026-05-16","",""
"01 Active Contracts","Waites Sensor Technology","MNDA - Waites & Designed Conveyor.pdf","Waites Sensor Technology/MNDA - Waites & Designed Conveyor.pdf",".pdf","2026-01-14","MNDA","False","Signed","False","","","","WAITES SENSOR TECHNOLOGIES, INC","2026-01-14","",""
"01 Active Contracts","Walmart","NDA 2.23.18 SA.docx","Walmart/NDA 2.23.18 SA.docx",".docx","2026-01-14","NDA","False","Signed","False","","","2.23.18","AND Walmart Inc","2026-01-14","",""
"02 Unsigned Contracts","Walmart","NDA 2.23.18 SA.pdf","Walmart/NDA 2.23.18 SA.pdf",".pdf","2026-01-14","NDA","False","Unsigned","False","","","2.23.18","Walmart","2026-01-14","",""
"01 Active Contracts","Walt Disney Parks and Resorts","Confidential Information Nondisclosure Agreement.pdf","Walt Disney Parks and Resorts/Confidential Information Nondisclosure Agreement.pdf",".pdf","2026-01-14","NDA","True","Signed","False","","","","Walt Disney Parks and Resorts U.S","2024-06-14","upon written notice",""
"02 Unsigned Contracts","Wayzim","Mutual NDA- Wayzim.docx","Wayzim/Mutual NDA- Wayzim.docx",".docx","2026-01-14","MNDA","False","Unsigned","False","","","","Wayzim Technology, Inc","2026-01-14","",""
"02 Unsigned Contracts","Western States Fire Protection","Mutual NDA Template_Feb 2022.docx","Western States Fire Protection/Mutual NDA Template_Feb 2022.docx",".docx","2026-01-14","MNDA","False","Unsigned","False","","","","Western States Fire Protection","2026-01-14","",""
"02 Unsigned Contracts","Wildeck","Wildeck- NDA.doc","Wildeck/Wildeck- NDA.doc",".doc","2026-01-14","NDA","False","Unsigned","False","","","","Wildeck","2026-01-14","",""
"01 Active Contracts","Williams Sonoma","MSA-Designed Conveyor Systems LLC-Eff_2025-08-11 CONT 6484 (part 2) - signed.pdf","Williams Sonoma/MSA-Designed Conveyor Systems LLC-Eff_2025-08-11 CONT 6484 (part 2) - signed.pdf",".pdf","2026-01-14","MSA","True","Signed","False","","","","Williams-Sonoma, Inc","2026-01-14","upon written notice",""
"02 Unsigned Contracts","Williams Sonoma","WSI Mutual Nondisclosure Agreement DCS Signed - audit report.pdf","Williams Sonoma/WSI Mutual Nondisclosure Agreement DCS Signed - audit report.pdf",".pdf","2026-01-14","MNDA","True","Unsigned","False","","","","Williams Sonoma","2025-06-08","",""
"02 Unsigned Contracts","WJE","Mutual NDA WJE_Feb 2022.pdf","WJE/Mutual NDA WJE_Feb 2022.pdf",".pdf","2026-01-14","MNDA","False","Unsigned","False","","","","Wiss, Janney, Elstner Associates, Inc","2026-01-14","",""
"02 Unsigned Contracts","World Wide Material Handling","DCS - NDA 3.23.26 - Final Executed.pdf","World Wide Material Handling/DCS - NDA 3.23.26 - Final Executed.pdf",".pdf","2026-03-25","NDA","True","Unsigned","False","","Final","3.23.26","World Wide Material Handling","2026-03-23","",""
"02 Unsigned Contracts","WSI","WSI Mutual Nondisclosure Agreement DCS Signed - audit report.pdf","WSI/WSI Mutual Nondisclosure Agreement DCS Signed - audit report.pdf",".pdf","2026-05-16","MNDA","True","Unsigned","False","","","","WSI","2025-06-08","",""
"01 Active Contracts","Yoder Services","DCS Vendor Mutual NDA to Yoder Services -  9.3.2024.pdf","Yoder Services/DCS Vendor Mutual NDA to Yoder Services -  9.3.2024.pdf",".pdf","2026-01-14","MNDA","True","Signed","False","","","9.3.2024","Yoder Services","2024-08-28","2026-08-28",""
"01 Active Contracts","Zone 4 Systems Integration and Design","Zone 4 - DCS Mutual NDA .pdf","Zone 4 Systems Integration and Design/Zone 4 - DCS Mutual NDA .pdf",".pdf","2026-01-14","MNDA","False","Signed","False","","","","Zone 4 Systems Integration and Design","2024-12-13","2026-12-13",""
"03 Archived Contracts","A. Land Electric","Mutual NDA-A. Land Electric.docx","A. Land Electric/Mutual NDA-A. Land Electric.docx",".docx","2026-05-18","MNDA","False","Unsigned","False","","","","A. Land Electric","","",""
"03 Archived Contracts","ACE","Mutual NDA ACE.docx","ACE/Mutual NDA ACE.docx",".docx","2026-05-18","MNDA","False","Unsigned","False","","","","ACE Companies Inc","","",""
